[
  {
    "id": "a-gr-lire-vecteur-normal",
    "chapter": "geometrie-reperee",
    "domain": "calcul-numerique-algebrique",
    "type": "qcm",
    "statement": "Quel est un vecteur normal à la droite $d : 3x - 5y + 2 = 0$ ?",
    "choices": [
      "$\\vec{n} = \\begin{pmatrix} -5 \\\\ 3 \\end{pmatrix}$",
      "$\\vec{n} = \\begin{pmatrix} 3 \\\\ -5 \\end{pmatrix}$",
      "$\\vec{n} = \\begin{pmatrix} 5 \\\\ 3 \\end{pmatrix}$",
      "$\\vec{n} = \\begin{pmatrix} 3 \\\\ 5 \\end{pmatrix}$"
    ],
    "answer": 1,
    "explanation": "L'équation $3x - 5y + 2 = 0$ est de la forme $ax + by + c = 0$ avec $a = 3$ et $b = -5$. Le vecteur normal est donc $\\vec{n} = \\begin{pmatrix} 3 \\\\ -5 \\end{pmatrix}$.",
    "difficulty": 1,
    "timeLimitSeconds": 30,
    "tags": ["vecteur-normal", "equation-droite"],
    "figure": {
      "type": "image",
      "data": {
        "src": "geometrie-reperee/droite-vecteur-normal.svg",
        "alt": "Droite d : 3x-5y+2=0 et son vecteur normal n(3;-5) représenté en rouge dans un repère orthonormé",
        "width": 400,
        "height": 320
      }
    }
  },
  {
    "id": "a-gr-vecteur-directeur-depuis-normal",
    "chapter": "geometrie-reperee",
    "domain": "calcul-numerique-algebrique",
    "type": "qcm",
    "statement": "La droite $d : 2x + y - 3 = 0$ a pour vecteur normal $\\vec{n} = \\begin{pmatrix} 2 \\\\ 1 \\end{pmatrix}$. Quel est un vecteur directeur de $d$ ?",
    "choices": [
      "$\\begin{pmatrix} 2 \\\\ 1 \\end{pmatrix}$",
      "$\\begin{pmatrix} 1 \\\\ -2 \\end{pmatrix}$",
      "$\\begin{pmatrix} -1 \\\\ 2 \\end{pmatrix}$",
      "$\\begin{pmatrix} 1 \\\\ 2 \\end{pmatrix}$"
    ],
    "answer": 2,
    "explanation": "Si $\\vec{n} = \\begin{pmatrix} a \\\\ b \\end{pmatrix}$ est normal, un vecteur directeur est $\\begin{pmatrix} -b \\\\ a \\end{pmatrix} = \\begin{pmatrix} -1 \\\\ 2 \\end{pmatrix}$. Vérification : $\\vec{n} \\cdot \\vec{u} = 2 \\times (-1) + 1 \\times 2 = 0$. ✓",
    "difficulty": 1,
    "timeLimitSeconds": 40,
    "tags": ["vecteur-directeur", "vecteur-normal"]
  },
  {
    "id": "a-gr-droites-paralleles-critere",
    "chapter": "geometrie-reperee",
    "domain": "calcul-numerique-algebrique",
    "type": "qcm",
    "statement": "Parmi les droites suivantes, laquelle est parallèle à $d_1 : 3x + 2y - 1 = 0$ ?",
    "choices": [
      "$d : 2x + 3y + 5 = 0$",
      "$d : 3x + 2y + 7 = 0$",
      "$d : 6x - 4y + 1 = 0$",
      "$d : 3x - 2y + 1 = 0$"
    ],
    "answer": 1,
    "explanation": "Deux droites sont parallèles si leurs vecteurs normaux sont colinéaires. $d_1$ a le vecteur normal $(3 ; 2)$. La droite $3x + 2y + 7 = 0$ a le même vecteur normal $(3 ; 2)$ : elles sont bien parallèles (et distinctes car $c$ diffère).",
    "difficulty": 1,
    "timeLimitSeconds": 45,
    "tags": ["parallele", "vecteur-normal", "droite"]
  },
  {
    "id": "a-gr-droites-perpendiculaires-critere",
    "chapter": "geometrie-reperee",
    "domain": "calcul-numerique-algebrique",
    "type": "qcm",
    "statement": "Quelle droite est perpendiculaire à $d : x - 2y + 3 = 0$ ?",
    "choices": [
      "$d' : x - 2y - 1 = 0$",
      "$d' : 2x + y + 5 = 0$",
      "$d' : x + 2y + 1 = 0$",
      "$d' : 2x - y + 1 = 0$"
    ],
    "answer": 1,
    "explanation": "$d$ a le vecteur normal $\\vec{n_1} = (1 ; -2)$. Pour $d' \\perp d$, il faut $\\vec{n_1} \\cdot \\vec{n_2} = 0$. La droite $2x + y + 5 = 0$ a $\\vec{n_2} = (2 ; 1)$ et $1 \\times 2 + (-2) \\times 1 = 0$. ✓",
    "difficulty": 2,
    "timeLimitSeconds": 50,
    "tags": ["perpendiculaire", "vecteur-normal", "produit-scalaire"]
  },
  {
    "id": "a-gr-lire-centre-rayon",
    "chapter": "geometrie-reperee",
    "domain": "fonctions-representations",
    "type": "qcm",
    "statement": "Le cercle d'équation $(x - 3)^2 + (y + 1)^2 = 25$ a pour centre et rayon :",
    "choices": [
      "Centre $(3 ; 1)$, rayon $25$",
      "Centre $(-3 ; 1)$, rayon $5$",
      "Centre $(3 ; -1)$, rayon $5$",
      "Centre $(3 ; -1)$, rayon $25$"
    ],
    "answer": 2,
    "explanation": "La forme $(x - a)^2 + (y - b)^2 = r^2$ donne centre $\\Omega(a ; b)$ et rayon $r$. Ici $a = 3$, $b = -1$ (attention au signe de $y + 1 = y - (-1)$) et $r^2 = 25$ donc $r = 5$.",
    "difficulty": 1,
    "timeLimitSeconds": 30,
    "tags": ["cercle", "centre", "rayon", "lecture"],
    "figure": {
      "type": "image",
      "data": {
        "src": "geometrie-reperee/cercle-centre-rayon-3-moins1.svg",
        "alt": "Cercle de centre Omega(3 ; -1) et rayon 5 dans un repère orthonormé, avec le rayon dessiné",
        "width": 400,
        "height": 320
      }
    }
  },
  {
    "id": "a-gr-point-sur-cercle",
    "chapter": "geometrie-reperee",
    "domain": "calcul-numerique-algebrique",
    "type": "qcm",
    "statement": "Le point $M(1 ; 4)$ appartient-il au cercle $(x - 1)^2 + (y - 1)^2 = 9$ ?",
    "choices": [
      "Oui, car $(1-1)^2 + (4-1)^2 = 9$",
      "Non, car $(1-1)^2 + (4-1)^2 = 3$",
      "Non, car $(1-1)^2 + (4-1)^2 = 7$",
      "Oui, car $(1-1)^2 + (4-1)^2 = 16$"
    ],
    "answer": 0,
    "explanation": "$(1-1)^2 + (4-1)^2 = 0 + 9 = 9 = r^2$. Le point $M$ est bien sur le cercle.",
    "difficulty": 1,
    "timeLimitSeconds": 30,
    "tags": ["appartenance", "cercle", "verification"]
  },
  {
    "id": "a-gr-cercle-forme-developpee-centre",
    "chapter": "geometrie-reperee",
    "domain": "calcul-numerique-algebrique",
    "type": "qcm",
    "statement": "Quel est le centre du cercle d'équation $x^2 + y^2 - 6x + 4y + 4 = 0$ ?",
    "choices": [
      "$(6 ; -4)$",
      "$(-3 ; 2)$",
      "$(3 ; -2)$",
      "$(-6 ; 4)$"
    ],
    "answer": 2,
    "explanation": "On identifie $p = -6$ et $q = 4$. Le centre est $\\left(-\\dfrac{p}{2} ; -\\dfrac{q}{2}\\right) = \\left(3 ; -2\\right)$.",
    "difficulty": 2,
    "timeLimitSeconds": 60,
    "tags": ["cercle", "forme-developpee", "centre"]
  },
  {
    "id": "a-gr-cercle-forme-developpee-rayon",
    "chapter": "geometrie-reperee",
    "domain": "calcul-numerique-algebrique",
    "type": "numeric",
    "statement": "Quel est le rayon du cercle d'équation $x^2 + y^2 - 6x + 4y + 4 = 0$ ?",
    "answer": 3,
    "tolerance": 0,
    "explanation": "Centre $(3 ; -2)$ donc $r^2 = \\dfrac{(-6)^2 + 4^2}{4} - 4 = \\dfrac{36 + 16}{4} - 4 = 13 - 4 = 9$. Rayon $r = 3$.",
    "difficulty": 2,
    "timeLimitSeconds": 60,
    "tags": ["cercle", "forme-developpee", "rayon"]
  },
  {
    "id": "a-gr-equation-cercle-depuis-centre-rayon",
    "chapter": "geometrie-reperee",
    "domain": "calcul-numerique-algebrique",
    "type": "qcm",
    "statement": "Quelle est l'équation du cercle de centre $\\Omega(2 ; -3)$ et de rayon $4$ ?",
    "choices": [
      "$(x+2)^2 + (y-3)^2 = 4$",
      "$(x-2)^2 + (y+3)^2 = 4$",
      "$(x-2)^2 + (y+3)^2 = 16$",
      "$(x+2)^2 + (y-3)^2 = 16$"
    ],
    "answer": 2,
    "explanation": "L'équation est $(x - 2)^2 + (y - (-3))^2 = 4^2$, soit $(x-2)^2 + (y+3)^2 = 16$.",
    "difficulty": 1,
    "timeLimitSeconds": 30,
    "tags": ["equation-cercle", "centre", "rayon"],
    "figure": {
      "type": "image",
      "data": {
        "src": "geometrie-reperee/cercle-centre-2-moins3-rayon-4.svg",
        "alt": "Cercle de centre Omega(2 ; -3) et rayon 4 dans un repère orthonormé",
        "width": 400,
        "height": 320
      }
    }
  },
  {
    "id": "a-gr-diametre-milieu-centre",
    "chapter": "geometrie-reperee",
    "domain": "calcul-numerique-algebrique",
    "type": "qcm",
    "statement": "Le cercle a pour diamètre $[AB]$ avec $A(0 ; 2)$ et $B(4 ; 6)$. Quel est son centre ?",
    "choices": [
      "$(2 ; 3)$",
      "$(4 ; 8)$",
      "$(2 ; 4)$",
      "$(1 ; 2)$"
    ],
    "answer": 2,
    "explanation": "Le centre est le milieu de $[AB]$ : $I\\left(\\dfrac{0+4}{2} ; \\dfrac{2+6}{2}\\right) = I(2 ; 4)$.",
    "difficulty": 1,
    "timeLimitSeconds": 30,
    "tags": ["cercle", "diametre", "milieu"]
  },
  {
    "id": "a-gr-diametre-rayon",
    "chapter": "geometrie-reperee",
    "domain": "calcul-numerique-algebrique",
    "type": "qcm",
    "statement": "Le cercle a pour diamètre $[AB]$ avec $A(0 ; 0)$ et $B(6 ; 0)$. Quel est son rayon ?",
    "choices": [
      "$6$",
      "$3$",
      "$\\sqrt{6}$",
      "$\\sqrt{18}$"
    ],
    "answer": 1,
    "explanation": "$AB = \\sqrt{(6-0)^2 + 0^2} = 6$. Le rayon est la moitié du diamètre : $r = \\dfrac{AB}{2} = 3$.",
    "difficulty": 1,
    "timeLimitSeconds": 30,
    "tags": ["cercle", "diametre", "rayon"]
  },
  {
    "id": "a-gr-caracterisation-diametre-produit-nul",
    "chapter": "geometrie-reperee",
    "domain": "calcul-numerique-algebrique",
    "type": "qcm",
    "statement": "Avec $A(0 ; 0)$ et $B(4 ; 0)$, le point $M(2 ; 2)$ est-il sur le cercle de diamètre $[AB]$ ?",
    "choices": [
      "Non, car $\\overrightarrow{MA} \\cdot \\overrightarrow{MB} = 4$",
      "Oui, car $\\overrightarrow{MA} \\cdot \\overrightarrow{MB} = 0$",
      "Non, car $\\overrightarrow{MA} \\cdot \\overrightarrow{MB} = -4$",
      "Oui, car $\\overrightarrow{MA} \\cdot \\overrightarrow{MB} = 4$"
    ],
    "answer": 1,
    "explanation": "$\\overrightarrow{MA} = (0-2 ; 0-2) = (-2 ; -2)$ et $\\overrightarrow{MB} = (4-2 ; 0-2) = (2 ; -2)$. Produit scalaire : $(-2)(2) + (-2)(-2) = -4 + 4 = 0$. Donc $M$ est bien sur le cercle de diamètre $[AB]$.",
    "difficulty": 2,
    "timeLimitSeconds": 60,
    "tags": ["cercle", "diametre", "produit-scalaire"]
  },
  {
    "id": "a-gr-equation-droite-point-perp",
    "chapter": "geometrie-reperee",
    "domain": "calcul-numerique-algebrique",
    "type": "qcm",
    "statement": "Quelle est l'équation de la droite passant par $A(2 ; 1)$ et perpendiculaire à $d : x + 3y - 2 = 0$ ?",
    "choices": [
      "$3x - y + 5 = 0$",
      "$x + 3y - 5 = 0$",
      "$3x - y - 5 = 0$",
      "$x - 3y + 1 = 0$"
    ],
    "answer": 2,